{
  "id": "FB-0204",
  "title": "Contributor profiles, reputation display, and customization",
  "slug": "profiles-and-customization",
  "track": "ecosystem",
  "status": "open",
  "size": "m",
  "difficulty": "intermediate",
  "reward": {
    "rep": 200,
    "bonus_rep": 50,
    "cash": null
  },
  "labels": [
    "epic-child"
  ],
  "skills": [
    "typescript",
    "react",
    "css"
  ],
  "targets": [
    {
      "type": "new-project",
      "value": "web/fermata-web"
    }
  ],
  "requested_by": {
    "handle": "ScottyVenable",
    "kind": "maintainer"
  },
  "created": "2026-09-01",
  "updated": "2026-09-01",
  "deadline": null,
  "epic": "EPIC-001",
  "depends_on": [
    "FB-0200"
  ],
  "blocks": [],
  "claim": {
    "ttl_days": 60,
    "max_concurrent": 1,
    "current": null,
    "history": []
  },
  "acceptance_count": 7,
  "completion": null
}
