{
  "id": "FB-0201",
  "title": "Accounts, authentication, and roles for the website",
  "slug": "accounts-and-authentication",
  "track": "ecosystem",
  "status": "open",
  "size": "l",
  "difficulty": "advanced",
  "reward": {
    "rep": 380,
    "bonus_rep": 80,
    "cash": null
  },
  "labels": [
    "epic-child"
  ],
  "skills": [
    "typescript",
    "auth",
    "oauth",
    "security"
  ],
  "targets": [
    {
      "type": "new-project",
      "value": "web/fermata-web"
    }
  ],
  "requested_by": {
    "handle": "ScottyVenable",
    "kind": "maintainer"
  },
  "created": "2026-09-01",
  "updated": "2026-09-01",
  "deadline": null,
  "epic": "EPIC-001",
  "depends_on": [
    "FB-0200"
  ],
  "blocks": [],
  "claim": {
    "ttl_days": 60,
    "max_concurrent": 1,
    "current": null,
    "history": []
  },
  "acceptance_count": 8,
  "completion": null
}
